"id","survey_pattern","created_at","gender","age","occupation","residence","residence_detail","visit_purpose_list","interested_sdgs_goal","current_sdgs_actions","sdgs_action_trigger","future_sdgs_interest","future_sdgs_actions","content_satisfaction","memorable_booth","learning_moments","learning_moments_detail","okayama_focus_areas","okayama_focus_other","sdgs_challenges","improvements"
"118","heavy","2025-08-07 07:22:57.485973+00","男性","大学生","学生","岡山県内","岡山県真庭市月田","[""展示見学""]","14. 海の豊かさを守ろう","[""節電・節水"",""マイバッグ・マイボトルの使用""]","なんとなく","はい","陸上養殖は海のない場所や山でも魚を養殖できるのですが、電気代がバカにならないらしいです。そこで、太陽光や風力発電等の持続可能な発電ができたらコスパよく環境にも優しいのではないかと思います。バイオマス発電でもいいですねぇ","{""展示"":""5"",""ステージ"":""5"",""ワークショップ"":""5"",""飲食"":""5"",""全体"":""5"",""その他（ステンレスボトル回収・マイボトル持参など）"":""5""}","82：岡山理科大学","はい","3階の学生の発表で、『人はやったことないことしかわからないからいろいろ経験してみたい』と学生がおっしゃっていたことが印象に残りました。","[""海ごみ問題"",""環境保全"",""フードロス"",""５Ｒ""]",,"利益にならないと誰もやってくれないのは厳しいところがありますよね。逆にいうと利益がでれば皆やってくれますからこれからの研鑽が重要になりますよね",""
"119","heavy","2025-08-07 07:25:12.082412+00","女性","50代","主婦","岡山県内","岡山市中区","[""展示見学""]","3. すべての人に健康と福祉を","[""節電・節水"",""フードロス削減"",""ゴミ分別""]","学校の授業","はい","ペ-パーレス化","{""ステージ"":""5"",""展示"":""3"",""ワークショップ"":""3"",""飲食"":""3"",""その他（ステンレスボトル回収・マイボトル持参など）"":""5"",""全体"":""5""}","その他","はい","植物を魚の水で育てる","[""海ごみ問題""]",,"し善を守る",""
"120","heavy","2025-08-07 07:29:38.623528+00","男性","40代","会社員","岡山県内","岡山市北区","[""ワークショップ""]","1. 貧困をなくそう","[""節電・節水"",""マイバッグ・マイボトルの使用"",""ペーパーレス化"",""ゴミ分別""]","会社の方針","はい","子供食堂","{""ステージ"":""3"",""ワークショップ"":""4"",""飲食"":""2"",""その他（ステンレスボトル回収・マイボトル持参など）"":""3"",""展示"":""3"",""全体"":""3""}","70：奉還町まるごとフリースクール","いいえ",,"[]","全ての子供達がお腹いっぱいにご飯を食べられる岡山市にしてほしい。","意識の高い人達の集まりになってると感じる。
もっと広く参加しやすいアトラクション等増やして欲しい。","受付がよくわからない。"
"121","heavy","2025-08-07 07:36:42.401849+00","女性","20代","会社員","岡山県内","岡山市","[""ワークショップ""]","3. すべての人に健康と福祉を","[""寄付・ボランティア""]","学校の影響","はい","分別をする","{""展示"":""1"",""ステージ"":""1"",""ワークショップ"":""1"",""飲食"":""1"",""その他（ステンレスボトル回収・マイボトル持参など）"":""1"",""全体"":""1""}","その他","はい","おさかなのお兄さんかわちゃんのステージが楽しかったです","[""海ごみ問題""]",,"全員が同じ気持ちになることが難しいと思う",""
"122","heavy","2025-08-07 07:38:09.930133+00","女性","30代","会社員","岡山県内","倉敷市","[""その他""]","14. 海の豊かさを守ろう","[""ゴミ分別"",""公共交通機関の利用""]","なんとなく","はい",,"{""展示"":""4"",""ステージ"":""4"",""ワークショップ"":""4"",""飲食"":""4"",""その他（ステンレスボトル回収・マイボトル持参など）"":""5"",""全体"":""4""}","90：公益財団法人岡山県環境保全事業団","はい",,"[""海ごみ問題"",""森林の有効活用"",""防災など安全・安心な社会"",""フードロス""]",,"環境問題については、個人の取り組みでは限界がある。",""
"123","heavy","2025-08-07 07:46:49.174372+00","男性","40代","会社員","岡山県内","中区","[""ワークショップ""]","3. すべての人に健康と福祉を","[""フードロス削減""]","ごみひろい","はい",,"{""展示"":""4"",""ステージ"":""3"",""飲食"":""3"",""ワークショップ"":""3"",""その他（ステンレスボトル回収・マイボトル持参など）"":""3"",""全体"":""3""}","94：社会福祉法人 旭川荘 吉備ワークホーム","いいえ",,"[""森林の有効活用""]",,"ゴミ拾い",""
"124","heavy","2025-08-07 07:55:33.7845+00","男性","60代","無職","岡山県内","倉敷","[""ステージ・講演""]","14. 海の豊かさを守ろう","[""節電・節水"",""フードロス削減"",""マイバッグ・マイボトルの使用"",""ゴミ分別""]","新聞他","はい","ゴミ分別","{""展示"":""4"",""ステージ"":""4"",""ワークショップ"":""4"",""飲食"":""4"",""その他（ステンレスボトル回収・マイボトル持参など）"":""4"",""全体"":""4""}","26：クリエイトグループ","はい","エコへの取り組み","[""海ごみ問題"",""森林の有効活用"",""フードロス""]",,"自然保護","特に無し"
"125","heavy","2025-08-07 07:56:58.234549+00","女性","60代","アルバイト","岡山県内","倉敷市","[""展示見学"",""ワークショップ""]","14. 海の豊かさを守ろう","[""フードロス削減"",""ゴミ分別""]","ゴミ問題","はい","ゴミをなくす","{""展示"":""4"",""ステージ"":""3"",""ワークショップ"":""4"",""飲食"":""3"",""その他（ステンレスボトル回収・マイボトル持参など）"":""4"",""全体"":""4""}","75：一般社団法人epoおかやま笑顔プロジェクト","はい","防災について","[""海ごみ問題"",""森林の有効活用"",""防災など安全・安心な社会""]",,"無駄が多い
もったいいないことしすぎ
ゴミを活用","またこんなイベントしてください"
"126","heavy","2025-08-07 07:57:28.939462+00","無回答","中学生以下","その他","岡山県内","北区","[""ワークショップ"",""展示見学""]","14. 海の豊かさを守ろう","[""フードロス削減""]","学校","はい","食べ物を残さない","{""展示"":""4"",""ステージ"":""4"",""ワークショップ"":""4"",""飲食"":""3"",""その他（ステンレスボトル回収・マイボトル持参など）"":""3"",""全体"":""3""}","33：岡山トヨタ自動車株式会社","はい","アクアポニックス","[""海ごみ問題""]",,"食品に対する意識の低さ",""
"127","heavy","2025-08-07 07:58:07.395593+00","女性","70代以上","主婦","岡山県内","倉敷市","[""ワークショップ"",""ステージ・講演"",""展示見学""]","8. 働きがいも経済成長も","[""節電・節水"",""フードロス削減"",""地産地消"",""マイバッグ・マイボトルの使用"",""ゴミ分別"",""寄付・ボランティア""]","メディア他","はい","フードロス削減、ゴミの分別他","{""展示"":""4"",""ステージ"":""5"",""ワークショップ"":""4"",""飲食"":""3"",""その他（ステンレスボトル回収・マイボトル持参など）"":""4"",""全体"":""4""}","1：株式会社中電工 岡山統括支社","はい",,"[""海ごみ問題"",""森林の有効活用"",""クリーンエネルギーへの転換"",""環境保全"",""５Ｒ"",""フードロス"",""多様性・共生社会""]",,"環境保護",""
"128","heavy","2025-08-08 01:37:35.657378+00","女性","60代","教職員","岡山県内","岡山市中区","[""ステージ・講演"",""展示見学""]","3. すべての人に健康と福祉を","[""節電・節水"",""公共交通機関の利用"",""ペーパーレス化"",""ゴミ分別"",""マイバッグ・マイボトルの使用""]","職場の取組","いいえ",,"{""展示"":""5"",""ステージ"":""5"",""ワークショップ"":""5"",""飲食"":""5"",""その他（ステンレスボトル回収・マイボトル持参など）"":""5"",""全体"":""5""}","101：一般社団法人コノヒトカン・岡山高等学校","はい",,"[""海ごみ問題"",""健康・福祉・貧困""]",,"それぞれが課題意識を持つこと",""
"129","heavy","2025-08-08 01:53:18.389953+00","男性","70代以上","無職","岡山県内","岡山市中区湊","[""展示見学""]","14. 海の豊かさを守ろう","[""ゴミ分別""]","マイクロこみの人体への害","はい","近くの用水のゴミ拾い","{""展示"":""1"",""ステージ"":""1"",""ワークショップ"":""2"",""飲食"":""1"",""全体"":""1"",""その他（ステンレスボトル回収・マイボトル持参など）"":""2""}","37：岡山高等学校","はい",,"[""海ごみ問題""]",,"ごみをなくす",""
"130","heavy","2025-08-08 02:04:43.159887+00","女性","40代","団体職員","岡山県内","岡山市中区","[""その他""]","11. 住み続けられるまちづくりを","[""寄付・ボランティア"",""ゴミ分別"",""マイバッグ・マイボトルの使用""]","子どもと取り組める","はい","ゴミ拾いを習慣にする","{""展示"":""1"",""ステージ"":""1"",""ワークショップ"":""1"",""飲食"":""1"",""その他（ステンレスボトル回収・マイボトル持参など）"":""1"",""全体"":""1""}","92：小中学生環境活動家 Crew","いいえ",,"[""海ごみ問題"",""健康・福祉・貧困"",""多様性・共生社会""]",,"知ってもらう事",""
"131","heavy","2025-08-08 02:15:26.286997+00","男性","70代以上","無職","岡山県内","岡山市北区","[""ステージ・講演""]","3. すべての人に健康と福祉を","[""節電・節水""]","新聞","いいえ",,"{""展示"":""4"",""ステージ"":""4"",""ワークショップ"":""4"",""飲食"":""5"",""その他（ステンレスボトル回収・マイボトル持参など）"":""4"",""全体"":""4""}","5：大王製紙株式会社","はい","貧困","[""健康・福祉・貧困""]",,"宣伝不足",""
"132","heavy","2025-08-08 02:16:36.106741+00","女性","30代","主婦","岡山県内","赤磐市","[""展示見学""]","11. 住み続けられるまちづくりを","[""節電・節水"",""フードロス削減"",""マイバッグ・マイボトルの使用"",""ペーパーレス化"",""ゴミ分別""]","日々できることを少しずつしています","いいえ",,"{""展示"":""4"",""飲食"":""4"",""ステージ"":""3"",""ワークショップ"":""3"",""その他（ステンレスボトル回収・マイボトル持参など）"":""3"",""全体"":""4""}","29：丸五ホールディングス株式会社","はい",,"[""森林の有効活用"",""海ごみ問題"",""防災など安全・安心な社会"",""健康・福祉・貧困"",""フードロス""]",,"ひとりひとりの意識の向上",""
"133","heavy","2025-08-08 02:26:27.626698+00","女性","30代","主婦","岡山県内","岡山市北区","[""展示見学""]","11. 住み続けられるまちづくりを","[""節電・節水"",""ゴミ分別""]","テレビ","はい","ゴミのさらなる分別","{""展示"":""5"",""ステージ"":""4"",""ワークショップ"":""4"",""飲食"":""5"",""その他（ステンレスボトル回収・マイボトル持参など）"":""4"",""全体"":""5""}","1：株式会社中電工 岡山統括支社","はい",,"[""森林の有効活用""]",,"一人一人が意識をもつこと",""